Gene_set,Term,Overlap,P-value,Adjusted P-value,Odds Ratio,Combined Score,Genes,condition,direction
gs_ind_0,Protein Ubiquitination (GO:0016567),1/367,0.7657005922717803,0.7692732630792565,1.0284426805572782,0.2745572307634178,RNF157,Stim48hr,positive
gs_ind_0,Negative Regulation Of Apoptotic Process (GO:0043066),1/368,0.7666387656029576,0.7692732630792565,1.0255617398474541,0.27253232456359,RNF157,Stim48hr,positive
gs_ind_0,Regulation Of DNA-templated Transcription (GO:0006355),5/1649,0.7861169551755917,0.7874653547556527,0.8203535594839942,0.1974178377285616,DKK3;HDAC4;PDX1;STAT4;BATF2,Stim48hr,positive
gs_ind_1,Cytoskeleton (GO:0005856),1/459,0.8382385287008044,0.8382385287008044,0.8160007931000297,0.14398544403974764,EPB41L4A,Stim48hr,positive
gs_ind_0,Positive Regulation Of Nucleic Acid-Templated Transcription (GO:1903508),1/492,0.8584627959647814,0.8584627959647814,0.7591787662998243,0.11585974104907161,HDAC4,Stim48hr,positive
gs_ind_0,Cardiac Cell Development (GO:0055006),2/11,0.0007975385210167216,0.08553600637904339,69.4275637547477,495.2948805913325,TCAP;ASB2,Stim48hr,negative
gs_ind_0,Microtubule Depolymerization (GO:0007019),2/11,0.0007975385210167216,0.08553600637904339,69.4275637547477,495.2948805913325,KIF2A;NCKAP5L,Stim48hr,negative
gs_ind_0,Negative Regulation Of Programmed Necrotic Cell Death (GO:0062099),2/9,0.0005246295213542784,0.08553600637904339,87.9553264604811,664.3105920686316,SLC25A4;YBX3,Stim48hr,negative
gs_ind_0,Negative Regulation Of Necroptotic Process (GO:0060546),2/8,0.0004090621467829918,0.08553600637904339,101.49484536082474,791.8265970749462,SLC25A4;YBX3,Stim48hr,negative
gs_ind_0,Cardiac Muscle Cell Development (GO:0055013),2/14,0.0013097565603804472,0.11237711288064235,52.75257731958763,350.16707104090267,TCAP;ASB2,Stim48hr,negative
gs_ind_0,Regulation Of Necroptotic Process (GO:0060544),2/18,0.002180342866880887,0.12730381592396542,39.951577631990006,244.83417994942937,SLC25A4;YBX3,Stim48hr,negative
gs_ind_0,Cardiac Muscle Cell Differentiation (GO:0055007),2/20,0.0026942055218599987,0.12730381592396542,35.62691557536918,210.7920582704607,TCAP;ASB2,Stim48hr,negative
gs_ind_0,Microtubule Polymerization Or Depolymerization (GO:0031109),2/18,0.002180342866880887,0.12730381592396542,39.951577631990006,244.83417994942937,KIF2A;NCKAP5L,Stim48hr,negative
gs_ind_0,Metallo-Sulfur Cluster Assembly (GO:0031163),2/23,0.003560945899971061,0.12730381592396542,30.648525533445216,172.7880832658589,NDUFAB1;BOLA3,Stim48hr,negative
gs_ind_0,Protein Depolymerization (GO:0051261),2/22,0.0032593723479508365,0.12730381592396542,32.14609001760121,184.0756039433194,KIF2A;NCKAP5L,Stim48hr,negative
gs_ind_0,Muscle Cell Development (GO:0055001),2/20,0.0026942055218599987,0.12730381592396542,35.62691557536918,210.7920582704607,TCAP;ASB2,Stim48hr,negative
gs_ind_0,Iron-Sulfur Cluster Assembly (GO:0016226),2/23,0.003560945899971061,0.12730381592396542,30.648525533445216,172.7880832658589,NDUFAB1;BOLA3,Stim48hr,negative
gs_ind_1,U4/U6 X U5 tri-snRNP Complex (GO:0046540),2/30,0.006017304275764831,0.12836915788298306,23.10815699041418,118.15468526649175,SNRPA;LSM5,Stim48hr,negative
gs_ind_1,Mitochondrial Matrix (GO:0005759),5/291,0.005295388039626743,0.12836915788298306,5.281763611606544,27.681295363047056,ACSM2A;ATP5F1A;NDUFAB1;MTERF4;BOLA3,Stim48hr,negative
gs_ind_1,Spliceosomal tri-snRNP Complex (GO:0097526),2/30,0.006017304275764831,0.12836915788298306,23.10815699041418,118.15468526649175,SNRPA;LSM5,Stim48hr,negative
gs_ind_0,Negative Regulation Of Endothelial Cell Proliferation (GO:0001937),2/27,0.004891546714490538,0.16142104157818776,25.832827976551446,137.437018413292,ATP5F1A;PDCD10,Stim48hr,negative
gs_ind_0,Dicarboxylic Acid Transport (GO:0006835),1/9,0.034479326540483864,0.16254539654799535,45.62032085561497,153.62165701114176,SLC13A2,Stim48hr,negative
gs_ind_0,Central Nervous System Projection Neuron Axonogenesis (GO:0021952),1/8,0.030706582427247244,0.16254539654799535,51.707070707070706,180.11011404439736,PAFAH1B1,Stim48hr,negative
gs_ind_0,Intrinsic Apoptotic Signaling Pathway In Response To Oxidative Stress (GO:0008631),1/9,0.034479326540483864,0.16254539654799535,45.62032085561497,153.62165701114176,PDCD10,Stim48hr,negative
gs_ind_0,Detection Of Muscle Stretch (GO:0035995),1/5,0.019301457634958472,0.16254539654799535,86.1986531986532,340.2756191617277,TCAP,Stim48hr,negative
gs_ind_0,Detection Of Mechanical Stimulus (GO:0050982),1/9,0.034479326540483864,0.16254539654799535,45.62032085561497,153.62165701114176,TCAP,Stim48hr,negative
gs_ind_0,Copper Ion Transport (GO:0006825),1/7,0.02691939239218921,0.16254539654799535,59.666666666666664,215.6895312713554,SLC31A1,Stim48hr,negative
gs_ind_0,Copper Ion Import (GO:0015677),1/3,0.011625086431596165,0.16254539654799535,155.1818181818182,691.271358781864,SLC31A1,Stim48hr,negative
gs_ind_0,"mRNA Splicing, Via Spliceosome (GO:0000398)",3/167,0.027039080263718936,0.16254539654799535,5.662038073908175,20.44263016829255,SNRPA;CWC15;LSM5,Stim48hr,negative
gs_ind_0,Mitochondrial Genome Maintenance (GO:0000002),1/9,0.034479326540483864,0.16254539654799535,45.62032085561497,153.62165701114176,SLC25A4,Stim48hr,negative
gs_ind_0,Monoacylglycerol Catabolic Process (GO:0052651),1/4,0.015470603953845034,0.16254539654799535,110.83549783549783,462.05252795000786,MGLL,Stim48hr,negative
gs_ind_0,Monoacylglycerol Metabolic Process (GO:0046462),1/8,0.030706582427247244,0.16254539654799535,51.707070707070706,180.11011404439736,MGLL,Stim48hr,negative
gs_ind_0,Monocarboxylic Acid Biosynthetic Process (GO:0072330),2/49,0.015521923632831294,0.16254539654799535,13.844275637547478,57.66835545468037,NDUFAB1;ACSM2A,Stim48hr,negative
gs_ind_0,Positive Regulation Of Focal Adhesion Disassembly (GO:0120183),1/5,0.019301457634958472,0.16254539654799535,86.1986531986532,340.2756191617277,DUSP3,Stim48hr,negative
gs_ind_0,mRNA Processing (GO:0006397),3/169,0.027878088421790004,0.16254539654799535,5.593140508929983,20.02296346575909,SNRPA;CWC15;LSM5,Stim48hr,negative
gs_ind_0,Nucleoside Triphosphate Metabolic Process (GO:0009141),1/9,0.034479326540483864,0.16254539654799535,45.62032085561497,153.62165701114176,ITPA,Stim48hr,negative
gs_ind_0,Response To Lithium Ion (GO:0010226),1/4,0.015470603953845034,0.16254539654799535,110.83549783549783,462.05252795000786,SLC13A2,Stim48hr,negative
gs_ind_0,Ribose Phosphate Biosynthetic Process (GO:0046390),1/5,0.019301457634958472,0.16254539654799535,86.1986531986532,340.2756191617277,PRPSAP2,Stim48hr,negative
gs_ind_0,Heparan Sulfate Proteoglycan Metabolic Process (GO:0030201),1/6,0.023117702254637218,0.16254539654799535,70.52066115702479,265.6623757759938,NDST1,Stim48hr,negative
gs_ind_0,"Heparan Sulfate Proteoglycan Biosynthetic Process, Polysaccharide Chain Biosynthetic Process (GO:0015014)",1/5,0.019301457634958472,0.16254539654799535,86.1986531986532,340.2756191617277,NDST1,Stim48hr,negative
gs_ind_0,"Heparan Sulfate Proteoglycan Biosynthetic Process, Enzymatic Modification (GO:0015015)",1/5,0.019301457634958472,0.16254539654799535,86.1986531986532,340.2756191617277,NDST1,Stim48hr,negative
gs_ind_0,Negative Regulation Of Mitochondrial Outer Membrane Permeabilization Involved In Apoptotic Signaling Pathway (GO:1901029),1/8,0.030706582427247244,0.16254539654799535,51.707070707070706,180.11011404439736,SLC25A4,Stim48hr,negative
gs_ind_0,Regulation Of Mitophagy (GO:1901524),1/6,0.023117702254637218,0.16254539654799535,70.52066115702479,265.6623757759938,SLC25A4,Stim48hr,negative
gs_ind_0,Mitochondrial Ribosome Assembly (GO:0061668),1/8,0.030706582427247244,0.16254539654799535,51.707070707070706,180.11011404439736,MTERF4,Stim48hr,negative
gs_ind_0,Negative Regulation Of Mitochondrial Membrane Permeability (GO:0035795),1/9,0.034479326540483864,0.16254539654799535,45.62032085561497,153.62165701114176,SLC25A4,Stim48hr,negative
gs_ind_0,Golgi Inheritance (GO:0048313),1/9,0.034479326540483864,0.16254539654799535,45.62032085561497,153.62165701114176,PDCD10,Stim48hr,negative
gs_ind_0,[2Fe-2S] Cluster Assembly (GO:0044571),1/8,0.030706582427247244,0.16254539654799535,51.707070707070706,180.11011404439736,NDUFAB1,Stim48hr,negative
gs_ind_0,Endothelium Development (GO:0003158),1/9,0.034479326540483864,0.16254539654799535,45.62032085561497,153.62165701114176,PDCD10,Stim48hr,negative
gs_ind_0,Peptidyl-Tyrosine Dephosphorylation Involved In Inactivation Of Protein Kinase Activity (GO:1990264),1/5,0.019301457634958472,0.16254539654799535,86.1986531986532,340.2756191617277,DUSP3,Stim48hr,negative
gs_ind_0,Platelet Activating Factor Metabolic Process (GO:0046469),1/6,0.023117702254637218,0.16254539654799535,70.52066115702479,265.6623757759938,PAFAH1B1,Stim48hr,negative
gs_ind_0,Polysaccharide Biosynthetic Process (GO:0000271),1/9,0.034479326540483864,0.16254539654799535,45.62032085561497,153.62165701114176,NDST1,Stim48hr,negative
gs_ind_0,Positive Regulation Of Autophagy Of Mitochondrion (GO:1903599),1/8,0.030706582427247244,0.16254539654799535,51.707070707070706,180.11011404439736,SLC25A4,Stim48hr,negative
gs_ind_0,Fatty Acid Biosynthetic Process (GO:0006633),2/48,0.014925094754028215,0.16254539654799535,14.143110519898016,59.46769621065053,NDUFAB1;ACSM2A,Stim48hr,negative
gs_ind_0,Striated Muscle Hypertrophy (GO:0014897),1/5,0.019301457634958472,0.16254539654799535,86.1986531986532,340.2756191617277,TCAP,Stim48hr,negative
gs_ind_0,Mitotic DNA Replication Checkpoint Signaling (GO:0033314),1/9,0.034479326540483864,0.16254539654799535,45.62032085561497,153.62165701114176,ORC1,Stim48hr,negative
gs_ind_0,Regulation Of Focal Adhesion Disassembly (GO:0120182),1/5,0.019301457634958472,0.16254539654799535,86.1986531986532,340.2756191617277,DUSP3,Stim48hr,negative
gs_ind_0,Negative Regulation Of Locomotion (GO:0040013),1/7,0.02691939239218921,0.16254539654799535,59.666666666666664,215.6895312713554,DUSP3,Stim48hr,negative
gs_ind_0,Establishment Of Golgi Localization (GO:0051683),1/6,0.023117702254637218,0.16254539654799535,70.52066115702479,265.6623757759938,PDCD10,Stim48hr,negative
gs_ind_0,Regulation Of Mitochondrial Fusion (GO:0010635),1/7,0.02691939239218921,0.16254539654799535,59.666666666666664,215.6895312713554,PLD6,Stim48hr,negative
gs_ind_0,Lipid Biosynthetic Process (GO:0008610),2/58,0.021340078638256984,0.16254539654799535,11.630781862968707,44.745575846852375,NDUFAB1;ACSM2A,Stim48hr,negative
gs_ind_0,Regulation Of Sensory Perception (GO:0051931),1/7,0.02691939239218921,0.16254539654799535,59.666666666666664,215.6895312713554,MGLL,Stim48hr,negative
gs_ind_0,Regulation Of Biosynthetic Process (GO:0009889),1/6,0.023117702254637218,0.16254539654799535,70.52066115702479,265.6623757759938,MID1IP1,Stim48hr,negative
gs_ind_0,Positive Regulation Of Mitophagy (GO:1901526),1/5,0.019301457634958472,0.16254539654799535,86.1986531986532,340.2756191617277,SLC25A4,Stim48hr,negative
gs_ind_0,Antigen Processing And Presentation Of Peptide Antigen Via MHC Class Ib (GO:0002428),1/4,0.015470603953845034,0.16254539654799535,110.83549783549783,462.05252795000786,ULBP1,Stim48hr,negative
gs_ind_0,Antigen Processing And Presentation Of Endogenous Peptide Antigen Via MHC Class Ib (GO:0002476),1/4,0.015470603953845034,0.16254539654799535,110.83549783549783,462.05252795000786,ULBP1,Stim48hr,negative
gs_ind_0,"Antigen Processing And Presentation Of Endogenous Peptide Antigen Via MHC Class I Via ER Pathway, TAP-independent (GO:0002486)",1/4,0.015470603953845034,0.16254539654799535,110.83549783549783,462.05252795000786,ULBP1,Stim48hr,negative
gs_ind_0,Antigen Processing And Presentation Of Endogenous Peptide Antigen Via MHC Class I Via ER Pathway (GO:0002484),1/4,0.015470603953845034,0.16254539654799535,110.83549783549783,462.05252795000786,ULBP1,Stim48hr,negative
gs_ind_0,Mitochondrial ATP Synthesis Coupled Electron Transport (GO:0042775),2/64,0.025645823084308243,0.16254539654799535,10.509278350515464,38.49942298836649,UQCRHL;NDUFAB1,Stim48hr,negative
gs_ind_0,Aerobic Electron Transport Chain (GO:0019646),2/62,0.024174017555306373,0.16254539654799535,10.858396523813582,40.42012998487457,UQCRHL;NDUFAB1,Stim48hr,negative
gs_ind_0,Adult Locomotory Behavior (GO:0008344),1/6,0.023117702254637218,0.16254539654799535,70.52066115702479,265.6623757759938,PAFAH1B1,Stim48hr,negative
gs_ind_0,Positive Regulation Of Mitochondrial Calcium Ion Concentration (GO:0051561),1/8,0.030706582427247244,0.16254539654799535,51.707070707070706,180.11011404439736,MCUR1,Stim48hr,negative
gs_ind_0,Adult Heart Development (GO:0007512),1/4,0.015470603953845034,0.16254539654799535,110.83549783549783,462.05252795000786,TCAP,Stim48hr,negative
gs_ind_0,Protein-Containing Complex Assembly (GO:0065003),4/266,0.01960876481825615,0.16254539654799535,4.623963133640553,18.180399425960967,TCAP;SLC31A1;ASB2;MID1IP1,Stim48hr,negative
gs_ind_0,Skeletal Muscle Thin Filament Assembly (GO:0030240),1/5,0.019301457634958472,0.16254539654799535,86.1986531986532,340.2756191617277,TCAP,Stim48hr,negative
gs_ind_0,Actomyosin Structure Organization (GO:0031032),2/49,0.015521923632831294,0.16254539654799535,13.844275637547478,57.66835545468037,TCAP;PDCD10,Stim48hr,negative
gs_ind_0,Regulation Of Sensory Perception Of Pain (GO:0051930),1/9,0.034479326540483864,0.16254539654799535,45.62032085561497,153.62165701114176,MGLL,Stim48hr,negative
gs_ind_0,Neuroblast Proliferation (GO:0007405),1/3,0.011625086431596165,0.16254539654799535,155.1818181818182,691.271358781864,PAFAH1B1,Stim48hr,negative
gs_ind_0,Negative Regulation Of Chromosome Organization (GO:2001251),1/7,0.02691939239218921,0.16254539654799535,59.666666666666664,215.6895312713554,SUB1,Stim48hr,negative
gs_ind_0,Negative Regulation Of Blood Vessel Endothelial Cell Proliferation Involved In Sprouting Angiogenesis (GO:1903588),1/5,0.019301457634958472,0.16254539654799535,86.1986531986532,340.2756191617277,PDCD10,Stim48hr,negative
gs_ind_0,ADP Transport (GO:0015866),1/7,0.02691939239218921,0.16254539654799535,59.666666666666664,215.6895312713554,SLC25A4,Stim48hr,negative
gs_ind_0,Neuromuscular Process (GO:0050905),1/9,0.034479326540483864,0.16254539654799535,45.62032085561497,153.62165701114176,PAFAH1B1,Stim48hr,negative
gs_ind_0,Neuromuscular Process Controlling Balance (GO:0050885),1/4,0.015470603953845034,0.16254539654799535,110.83549783549783,462.05252795000786,PAFAH1B1,Stim48hr,negative
gs_ind_0,Brain Morphogenesis (GO:0048854),1/7,0.02691939239218921,0.16254539654799535,59.666666666666664,215.6895312713554,PAFAH1B1,Stim48hr,negative
gs_ind_0,Cellular Hyperosmotic Response (GO:0071474),1/5,0.019301457634958472,0.16254539654799535,86.1986531986532,340.2756191617277,YBX3,Stim48hr,negative
gs_ind_0,Hyperosmotic Response (GO:0006972),1/4,0.015470603953845034,0.16254539654799535,110.83549783549783,462.05252795000786,YBX3,Stim48hr,negative
gs_ind_0,Positive Regulation Of Ligase Activity (GO:0051351),1/7,0.02691939239218921,0.16254539654799535,59.666666666666664,215.6895312713554,MID1IP1,Stim48hr,negative
gs_ind_0,"RNA Splicing, Via Transesterification Reactions With Bulged Adenosine As Nucleophile (GO:0000377)",3/141,0.01739549000064702,0.16254539654799535,6.738780163404902,27.302466371611782,SNRPA;CWC15;LSM5,Stim48hr,negative
gs_ind_0,Medium-Chain fatty-acyl-CoA Metabolic Process (GO:0036112),1/5,0.019301457634958472,0.16254539654799535,86.1986531986532,340.2756191617277,ACSM2A,Stim48hr,negative
gs_ind_0,C4-dicarboxylate Transport (GO:0015740),1/8,0.030706582427247244,0.16254539654799535,51.707070707070706,180.11011404439736,SLC13A2,Stim48hr,negative
gs_ind_0,Cardiocyte Differentiation (GO:0035051),1/8,0.030706582427247244,0.16254539654799535,51.707070707070706,180.11011404439736,ASB2,Stim48hr,negative
gs_ind_0,Cardiac Myofibril Assembly (GO:0055003),1/8,0.030706582427247244,0.16254539654799535,51.707070707070706,180.11011404439736,TCAP,Stim48hr,negative
gs_ind_0,Nucleoside Phosphate Catabolic Process (GO:1901292),1/8,0.030706582427247244,0.16254539654799535,51.707070707070706,180.11011404439736,ITPA,Stim48hr,negative
gs_ind_0,Cardiac Muscle Tissue Development (GO:0048738),2/33,0.0072497461949431,0.16254539654799535,20.902470954017346,102.98206017156117,TCAP;ASB2,Stim48hr,negative
gs_ind_0,Cardiac Muscle Hypertrophy (GO:0003300),1/5,0.019301457634958472,0.16254539654799535,86.1986531986532,340.2756191617277,TCAP,Stim48hr,negative
gs_ind_0,Natural Killer Cell Activation (GO:0030101),2/33,0.0072497461949431,0.16254539654799535,20.902470954017346,102.98206017156117,IL21R;ULBP1,Stim48hr,negative
gs_ind_0,Vascular Endothelial Growth Factor Receptor-2 Signaling Pathway (GO:0036324),1/4,0.015470603953845034,0.16254539654799535,110.83549783549783,462.05252795000786,SLC31A1,Stim48hr,negative
gs_ind_0,Calcium Ion Import (GO:0070509),1/7,0.02691939239218921,0.16254539654799535,59.666666666666664,215.6895312713554,MCUR1,Stim48hr,negative
gs_ind_0,Calcium Import Into The Mitochondrion (GO:0036444),1/9,0.034479326540483864,0.16254539654799535,45.62032085561497,153.62165701114176,MCUR1,Stim48hr,negative
gs_ind_0,Skeletal Myofibril Assembly (GO:0014866),1/6,0.023117702254637218,0.16254539654799535,70.52066115702479,265.6623757759938,TCAP,Stim48hr,negative
gs_ind_1,Spliceosomal snRNP Complex (GO:0097525),2/49,0.015521923632831294,0.1643925493663091,13.844275637547478,57.66835545468037,SNRPA;LSM5,Stim48hr,negative
gs_ind_1,Spindle Microtubule (GO:0005876),2/59,0.022034655908598832,0.1643925493663091,11.427610936799642,43.59792183612321,KIF2A;PAFAH1B1,Stim48hr,negative
gs_ind_1,Organelle Inner Membrane (GO:0019866),4/273,0.02134371974761891,0.1643925493663091,4.501346579687594,17.316670117215974,NDUFAB1;ATP5F1A;SLC25A4;MCUR1,Stim48hr,negative
gs_ind_1,Astral Microtubule (GO:0000235),1/6,0.023117702254637218,0.1643925493663091,70.52066115702479,265.6623757759938,PAFAH1B1,Stim48hr,negative
gs_ind_1,Mitochondrial Membrane (GO:0031966),5/400,0.0191378433629573,0.1643925493663091,3.792792542476487,15.004619456650621,ATP5F1A;MCUR1;SLC25A4;NDUFAB1;PLD6,Stim48hr,negative
gs_ind_1,Mitochondrial Inner Membrane (GO:0005743),4/253,0.016626627379085667,0.1643925493663091,4.869933415217532,19.950898792370793,NDUFAB1;ATP5F1A;SLC25A4;MCUR1,Stim48hr,negative
gs_ind_0,Magnesium Ion Transport (GO:0015693),1/10,0.03823767871432395,0.1673873894739283,40.81499202551834,133.21743592557962,TUSC3,Stim48hr,negative
gs_ind_0,Negative Regulation Of Cell Migration Involved In Sprouting Angiogenesis (GO:0090051),1/10,0.03823767871432395,0.1673873894739283,40.81499202551834,133.21743592557962,PDCD10,Stim48hr,negative
gs_ind_0,Muscle Tissue Morphogenesis (GO:0060415),1/10,0.03823767871432395,0.1673873894739283,40.81499202551834,133.21743592557962,TCAP,Stim48hr,negative
gs_ind_0,Purine Ribonucleoside Triphosphate Biosynthetic Process (GO:0009206),1/10,0.03823767871432395,0.1673873894739283,40.81499202551834,133.21743592557962,ATP5F1A,Stim48hr,negative
gs_ind_0,Negative Regulation Of Dephosphorylation (GO:0035305),1/10,0.03823767871432395,0.1673873894739283,40.81499202551834,133.21743592557962,ENSA,Stim48hr,negative
gs_ind_0,Antigen Processing And Presentation Of Endogenous Peptide Antigen (GO:0002483),1/10,0.03823767871432395,0.1673873894739283,40.81499202551834,133.21743592557962,ULBP1,Stim48hr,negative
gs_ind_0,Retrograde Axonal Transport (GO:0008090),1/10,0.03823767871432395,0.1673873894739283,40.81499202551834,133.21743592557962,PAFAH1B1,Stim48hr,negative
gs_ind_1,Brahma Complex (GO:0035060),1/13,0.04942692046489106,0.17001037044876172,31.01212121212121,93.26151332766753,SMARCC1,Stim48hr,negative
gs_ind_1,GBAF Complex (GO:0140288),1/13,0.04942692046489106,0.17001037044876172,31.01212121212121,93.26151332766753,SMARCC1,Stim48hr,negative
gs_ind_1,Intracellular Organelle Lumen (GO:0070013),6/660,0.04180260766612028,0.17001037044876172,2.7116762946240804,8.60902056398034,ACSM2A;ATP5F1A;PSMD7;NDUFAB1;MTERF4;BOLA3,Stim48hr,negative
gs_ind_1,Mitochondrial Respiratory Chain Complex III (GO:0005750),1/10,0.03823767871432395,0.17001037044876172,40.81499202551834,133.21743592557962,UQCRHL,Stim48hr,negative
gs_ind_1,RSC-type Complex (GO:0016586),1/14,0.05312824076523803,0.17001037044876172,28.712682379349047,84.27306225753972,SMARCC1,Stim48hr,negative
gs_ind_1,Respiratory Chain Complex III (GO:0045275),1/10,0.03823767871432395,0.17001037044876172,40.81499202551834,133.21743592557962,UQCRHL,Stim48hr,negative
gs_ind_1,"Transferase Complex, Transferring Phosphorus-Containing Groups (GO:0061695)",1/8,0.030706582427247244,0.17001037044876172,51.707070707070706,180.11011404439736,PRPSAP2,Stim48hr,negative
gs_ind_1,npBAF Complex (GO:0071564),1/12,0.04571142218653305,0.17001037044876172,33.71146245059288,104.01358471573793,SMARCC1,Stim48hr,negative
gs_ind_1,U2-type Spliceosomal Complex (GO:0005684),2/74,0.03352835256892963,0.17001037044876172,9.05261286882332,30.73691450781642,CWC15;LSM5,Stim48hr,negative
gs_ind_1,U6 snRNP (GO:0005688),1/7,0.02691939239218921,0.17001037044876172,59.666666666666664,215.6895312713554,LSM5,Stim48hr,negative
gs_ind_1,nBAF Complex (GO:0071565),1/14,0.05312824076523803,0.17001037044876172,28.712682379349047,84.27306225753972,SMARCC1,Stim48hr,negative
gs_ind_0,Stress Fiber Assembly (GO:0043149),1/11,0.041981692733654666,0.17152520174036048,36.924963924963926,117.07139729180082,PDCD10,Stim48hr,negative
gs_ind_0,Mitochondrial Transcription (GO:0006390),1/11,0.041981692733654666,0.17152520174036048,36.924963924963926,117.07139729180082,MTERF4,Stim48hr,negative
gs_ind_0,Response To Muscle Stretch (GO:0035994),1/11,0.041981692733654666,0.17152520174036048,36.924963924963926,117.07139729180082,TCAP,Stim48hr,negative
gs_ind_0,3'-UTR-mediated mRNA Stabilization (GO:0070935),1/11,0.041981692733654666,0.17152520174036048,36.924963924963926,117.07139729180082,YBX3,Stim48hr,negative
gs_ind_0,"Mitochondrial Electron Transport, Ubiquinol To Cytochrome C (GO:0006122)",1/11,0.041981692733654666,0.17152520174036048,36.924963924963926,117.07139729180082,UQCRHL,Stim48hr,negative
gs_ind_0,ATP Transport (GO:0015867),1/11,0.041981692733654666,0.17152520174036048,36.924963924963926,117.07139729180082,SLC25A4,Stim48hr,negative
gs_ind_0,Contractile Actin Filament Bundle Assembly (GO:0030038),1/11,0.041981692733654666,0.17152520174036048,36.924963924963926,117.07139729180082,PDCD10,Stim48hr,negative
gs_ind_1,U1 snRNP (GO:0005685),1/15,0.05681543608936094,0.17315180522471904,26.730407523510973,76.66139816140708,SNRPA,Stim48hr,negative
gs_ind_0,Regulation Of Blood Vessel Endothelial Cell Proliferation Involved In Sprouting Angiogenesis (GO:1903587),1/12,0.04571142218653305,0.17509107248234534,33.71146245059288,104.01358471573793,PDCD10,Stim48hr,negative
gs_ind_0,piRNA Processing (GO:0034587),1/12,0.04571142218653305,0.17509107248234534,33.71146245059288,104.01358471573793,PLD6,Stim48hr,negative
gs_ind_0,Positive Regulation Of Fatty Acid Biosynthetic Process (GO:0045723),1/12,0.04571142218653305,0.17509107248234534,33.71146245059288,104.01358471573793,MID1IP1,Stim48hr,negative
gs_ind_0,Positive Regulation Of Cytoplasmic Translation (GO:2000767),1/12,0.04571142218653305,0.17509107248234534,33.71146245059288,104.01358471573793,YBX3,Stim48hr,negative
gs_ind_0,Mitotic DNA Integrity Checkpoint Signaling (GO:0044774),1/12,0.04571142218653305,0.17509107248234534,33.71146245059288,104.01358471573793,ORC1,Stim48hr,negative
gs_ind_0,"mRNA Cis Splicing, Via Spliceosome (GO:0045292)",1/12,0.04571142218653305,0.17509107248234534,33.71146245059288,104.01358471573793,CWC15,Stim48hr,negative
gs_ind_0,Ether Lipid Metabolic Process (GO:0046485),1/12,0.04571142218653305,0.17509107248234534,33.71146245059288,104.01358471573793,PAFAH1B1,Stim48hr,negative
gs_ind_0,Regulation Of Golgi Organization (GO:1903358),1/13,0.04942692046489106,0.17670124066198553,31.01212121212121,93.26151332766753,PDCD10,Stim48hr,negative
gs_ind_0,Xenobiotic Transport (GO:0042908),1/13,0.04942692046489106,0.17670124066198553,31.01212121212121,93.26151332766753,SLC31A1,Stim48hr,negative
gs_ind_0,Epiboly Involved In Wound Healing (GO:0090505),1/13,0.04942692046489106,0.17670124066198553,31.01212121212121,93.26151332766753,PDCD10,Stim48hr,negative
gs_ind_0,Dendritic Cell Migration (GO:0036336),1/13,0.04942692046489106,0.17670124066198553,31.01212121212121,93.26151332766753,ASB2,Stim48hr,negative
gs_ind_0,Mitochondrial Calcium Ion Transmembrane Transport (GO:0006851),1/13,0.04942692046489106,0.17670124066198553,31.01212121212121,93.26151332766753,MCUR1,Stim48hr,negative
gs_ind_0,Protein Maturation By Iron-Sulfur Cluster Transfer (GO:0097428),1/13,0.04942692046489106,0.17670124066198553,31.01212121212121,93.26151332766753,BOLA3,Stim48hr,negative
gs_ind_0,B Cell Mediated Immunity (GO:0019724),1/13,0.04942692046489106,0.17670124066198553,31.01212121212121,93.26151332766753,IL21R,Stim48hr,negative
gs_ind_0,Nuclear Migration (GO:0007097),1/13,0.04942692046489106,0.17670124066198553,31.01212121212121,93.26151332766753,PAFAH1B1,Stim48hr,negative
gs_ind_0,Negative Regulation Of Microtubule Depolymerization (GO:0007026),1/15,0.05681543608936094,0.17869706078710684,26.730407523510973,76.66139816140708,MID1IP1,Stim48hr,negative
gs_ind_0,Protein Glycosylation (GO:0006486),2/105,0.06284753264651338,0.17869706078710684,6.325763235220878,17.50366269112809,SERP2;TUSC3,Stim48hr,negative
gs_ind_0,Ribonucleoside Bisphosphate Metabolic Process (GO:0033875),1/17,0.06414766284665374,0.17869706078710684,23.486685032139576,64.50776863897842,ACSM2A,Stim48hr,negative
gs_ind_0,Purine Nucleoside Bisphosphate Metabolic Process (GO:0034032),1/17,0.06414766284665374,0.17869706078710684,23.486685032139576,64.50776863897842,ACSM2A,Stim48hr,negative
gs_ind_0,Purine Ribonucleotide Transport (GO:0015868),1/15,0.05681543608936094,0.17869706078710684,26.730407523510973,76.66139816140708,SLC25A4,Stim48hr,negative
gs_ind_0,Nucleosome Disassembly (GO:0006337),1/15,0.05681543608936094,0.17869706078710684,26.730407523510973,76.66139816140708,SMARCC1,Stim48hr,negative
gs_ind_0,Negative Regulation Of ERBB Signaling Pathway (GO:1901185),1/16,0.06048855924502194,0.17869706078710684,25.003910068426197,70.14349479939649,DUSP3,Stim48hr,negative
